{
  "schema_version": "companion.normalized-interaction-event.v1",
  "event_id": "evt-astrbot-0001",
  "trace_id": "trace-astrbot-0001",
  "event_kind": "user_message",
  "scope": {
    "ecosystem_id": "ecosystem-main",
    "installation_id": "installation-main",
    "runtime_instance_id": "runtime-astrbot-01",
    "host_kind": "astrbot",
    "host_id": "astrbot-host",
    "bot_id": "bot-main",
    "platform": "aiocqhttp",
    "account_id": "qq-bot-001",
    "conversation_ref": "conversation-private-123",
    "platform_conversation_id": "private-user-123",
    "conversation_id": null,
    "session_id": "session-20260909-001",
    "user_id": "user-123",
    "group_id": null,
    "persona_id": "persona-main",
    "persona_binding_revision": 12
  },
  "scope_mode": "user",
  "subject_ref": "user-123",
  "conversation_ref": "conversation-private-123",
  "session_ref": "session-20260909-001",
  "occurred_at": "2026-09-09T10:00:00+08:00",
  "observed_at": "2026-09-09T10:00:01+08:00",
  "expires_at": "2026-09-09T10:30:00+08:00",
  "evidence_refs": ["evidence-astrbot-0001"],
  "payload": {
    "content_kind": "text_summary",
    "summary": "用户询问昨晚共同阅读的进度，并希望继续。",
    "content_ref": null,
    "content_hash": "sha256:9d3e4a",
    "structured": null,
    "byte_length": 54,
    "redaction": "summary_only",
    "language": "zh-CN"
  },
  "visibility": "user_shared",
  "reality_mode": "observed",
  "source_adapter": "astrbot-readonly",
  "adapter_generation": "astrbot-adapter-gen-3",
  "dedupe_key": "astrbot:aiocqhttp:qq-bot-001:evt-astrbot-0001",
  "extensions": {}
}
